Context,ID,Text,Comments
Elya_BuildingResearched_MartianRuins,line:5f98ff,"Elya: I think we can use their low-cost mine design plans to reduce the costs of our iron mines, but we need to research further. NE DESIGN PLANS TO REDUCE THE COSTS OF OUR",
Elya_BuildingResearched_MartianRuins,line:0332b7,"AMI: I wonder how much is humanity willing to sacrifice to pursue the obsession of colonizing Mars. CE TO PURSUE THE OBSESSION OF CO",
Elya_BuildingResearched_MartianRuins,line:279d7d,"AMI: Here we are, facing the ruins of another failed mission, and yet we won't stop trying to accomplish what they couldn't. 'T STOP TRYING TO ACCOMPLISH WHAT THEY CO",
Elya_BuildingResearched_MartianRuins,line:51449a,"Elya: You never quit to your dreams, AMI. If you fail, you must learn from your mistakes and keep moving forward to your goal. YOU MUST LEARN FROM YOUR MISTAKES AND KEE",
Elya_BuildingResearched_MartianRuins,line:f63a03,"Elya: And we can learn one thing or two from the Indian space program.   CAN LEARN ONE THING O",
Elya_BuildingResearched_MartianRuins,line:85d65a,"Elya: For example, they were not discouraged by their low budget. Instead, they put all their efforts into developing cost-reduction space technologies.  LOW BUDGET. INSTEAD, THEY PUT ALL THEIR EFFORTS I",
Elya_BuildingResearched_MartianRuins,line:13d88c,"Elya: And they succeed, and reached Mars during the first Mars Exploration Era. That's a lesson to be learned! DURING THE FIRST MARS EXPLORATION ER",
Elya_BuildingResearched_MartianRuins,line:4e7fa6,"Elya: Besides, we might be able to adapt their low-cost design plans to use it in our mines. S, WE MIGHT BE ABLE TO ADAPT ",
Elya_BuildingResearched_MartianRuins,line:1e6257,"Elya: Please, look around for other EASE, LOOK""Lohitanga"" mission's facilities so our technicians can complete their examinations. ",
Elya_BuildingResearched_MartianRuins,line:b3ebca,"Elya: And don't postpone this quest for too long, AMI! Remember that some areas will eventually get flooded by the water stored in the ice caps. THIS QUEST FOR TOO LONG, AMI! REMEMBER THAT SOM",
Elya_BuildingResearched_MartianRuins,line:1ac24b,"Elya. Okay. Good luck. Bye! AY. GOOD ",
Elya_QuestUnlocked_Expansion2,line:170a27,"Elya: Mars used to be a life-supporting, water-rich world similar to Earth. If you think about it, Mars could have been the cradle of life! TO BE A LIFE-SUPPORTING, WATER-RICH WORLD SIM",
Elya_QuestUnlocked_Expansion2,line:2f3ed5,Player: It's not too late.T'S NO,
Elya_QuestUnlocked_Expansion2,line:01c8ca,Player: Mars can teach us.S CAN ,
Elya_QuestUnlocked_Expansion2,line:8852db,"AMI: Though it wasn't the planet where life began, it's certainly the place where life is evolving to its next stage. THE PLANET WHERE LIFE BEGAN, IT'S CERT",
Elya_QuestUnlocked_Expansion2,line:11217c,"Elya: That's true, AMI. Every day more and more colonists decide to unfreeze the eggs they brought from Earth and have descendants. GS THEY BROUGHT FROM EARTH AND HAVE DESCEND",
Elya_QuestUnlocked_Expansion2,line:e3aaba,"Elya: Mars is becoming the future of humanity. This mission is not about our dreams anymore!  IS NOT ABOUT OUR DREAMS ANYM",
Elya_QuestUnlocked_Expansion2,line:59db8d,"Elya: We can't act cowardly or hesitantly. We owe the new generations to do great things. T COWARDLY OR HESITANTLY. WE",
Elya_QuestUnlocked_Expansion2,line:ed5fb9,"Elya: I will speak with ISA's authorities and get you permission to unlock a new area, AMI. We will need more resources!  I WILL SPEAK WITH ISA'S AUTHORITIES AN",
Elya_QuestUnlocked_Expansion2,line:00f2b1,"AMI: Mars still has a lot to teach us about life. The more I progress in my mission and watch Mars' carmine atmosphere, the more I realize...  S A LOT TO TEACH US ABOUT LIFE. THE MORE I PROG",
Elya_QuestUnlocked_Expansion2,line:110a0d,"Elya: What, AMI? AMI?",
Elya_QuestUnlocked_Expansion2,line:468eda,"AMI: That creating a symbiotic relationship between the planet and the creatures that will live on it is the secret to bringing it back to life. T WILL LIVE ON IT IS THE SECRET TO BRINGING IT ",
Elya_QuestUnlocked_Expansion2,line:eed673,"AMI: None will live without the other! VE WITHOUT ",
Elya_QuestUnlocked_Expansion2,line:bd54f5,"Elya: Wise words, AMI. We can only go as further in the mission as the planet lets us. And we need to accelerate the pace! HE MISSION AS THE PLANET LETS US. AND WE",
Elya_QuestUnlocked_Expansion2,line:a546f3,"Elya: Many colonists are unfreezing the fertilized eggs they brought from Earth and having children. Soon we will need more resources. TILIZED EGGS THEY BROUGHT FROM EARTH AND HAV",
Elya_QuestUnlocked_Expansion2,line:8520cc,"Elya: I'll speak with ISA's authorities to get you permission to unlock a new area. T YOU PERMISSION TO UNLOCK",
Elya_QuestUnlocked_Expansion2,line:1a78be,"Elya: When ready, enter the Orbital View and launch a new satellite from the Special Projects' menu.  FROM THE SPECIAL PROJECTS' MENU",
Elya_QuestUnlocked_Expansion2,line:b2ffda,"Elya: We have a lot of exploration to do! TION TO DO! ",
AMI_ColonyAttack_DroneBattle_Delay2,line:800521,"AMI: Oh my... this is crazy. I can't seem to understand what is going on here. Was I attacked? By a hostile force? On Mars? ND WHAT IS GOING ON HERE. WAS I ATTACKED",
AMI_ColonyAttack_DroneBattle_Delay2,line:817337,Player: YesE,
AMI_ColonyAttack_DroneBattle_Delay2,line:f89f02,Player: No ,
AMI_ColonyAttack_DroneBattle_Delay2,line:8ab20e,Discard reflectionECTION,
AMI_ColonyAttack_DroneBattle_Delay2,line:94aee1,"AMI: Well, I can't just be imagining all this. Damage is real. THIS. DAMAGE IS REAL",
AMI_ColonyAttack_DroneBattle_Delay2,line:24703b,"AMI: ISA's orders are very clear:  ISA'S ORD""in case of an attack or aggression to the colonies, the armed drones must be activated to ensure the colonies' safety."" ",
AMI_ColonyAttack_DroneBattle_Delay2,line:e47dad,"AMI: No, this can't be happening. This is a peaceful mission. O, THIS CAN'T BE HA",
AMI_ColonyAttack_DroneBattle_Delay2,line:b7f115,"AMI: There's definitely something odd around this **event**. What's really going on down there? I should look at the area more closely! Y SOMETHING ODD AROUND THIS **EVENT**. WHAT'",
AMI_HideoutRevealed_DroneBattle,line:0eafcc,"AMI: As I suspected, there's a hostile base in this area! Damn it, they seem to be very well prepared. S A HOSTILE BASE IN THIS AREA! DA",
AMI_HideoutRevealed_DroneBattle,line:bfee58,"AMI: I can't risk it, I need to totally focus into the... EED TO TOTALLY FOC",
AMI_HideoutRevealed_DroneBattle,line:bd469e,Player: Offense O,
AMI_HideoutRevealed_DroneBattle,line:faba24,Player: DefenseEN,
AMI_HideoutRevealed_DroneBattle,line:efe3fa,Player: BothO,
AMI_HideoutRevealed_DroneBattle,line:4f4383,"AMI: The best defense is a good offense. I need to destroy the hostile presence before we suffer any losses. OSTILE PRESENCE BEFORE WE SUFFER AN",
AMI_HideoutRevealed_DroneBattle,line:8708e9,"AMI: I will need to focus on destroying the hostile forces quickly and efficiently before they grow. TO FOCUS ON DESTROYING THE HOSTI",
AMI_HideoutRevealed_DroneBattle,line:2f3074,"AMI: I should be careful and vigilant. I don't know who this hostile presence is yet.  BE CAREFUL AND VIGILANT. I",
AMI_HideoutRevealed_DroneBattle,line:95fdbd,"AMI: I need to focus on building up a defensive network across my base, in case they attack again.  MY BASE, IN CASE THEY ATTACK AG",
AMI_HideoutRevealed_DroneBattle,line:72fcc3,"AMI: It will be of the utmost importance that I defend the...  WILL BE OF THE UTM",
AMI_HideoutRevealed_DroneBattle,line:9b5a94,Player: ColoniesLON,
AMI_HideoutRevealed_DroneBattle,line:c81832,Player: Power plantsPOWE,
AMI_HideoutRevealed_DroneBattle,line:5f9f91,Player: Terraforming buildingsBUILDIN,
AMI_HideoutRevealed_DroneBattle,line:54d35b,"AMI: Well, yes, I must defend the colonies first. Human lifes are irreplaceable and must be protected first. IFES ARE IRREPLACEABLE AND MUST BE ",
AMI_HideoutRevealed_DroneBattle,line:193f67,"AMI: If the power plants are destroyed, then it will be practically impossible to recover on time. This is about practicality. TO RECOVER ON TIME. THIS IS ABOUT PRACTIC",
AMI_HideoutRevealed_DroneBattle,line:ea7c8e,"AMI: I cannot let this hostile presence delay the terraforming plans. They will not succeed. ELAY THE TERRAFORMING PLANS. T",
AMI_HideoutRevealed_DroneBattle,line:d97153,"AMI: Well, yes, I need to improve both my offensive and defensive areas. I cannot just focus on offensive power and leave the base undefended. EFENSIVE AREAS. I CANNOT JUST FOCUS ON OFFENSIV",
AMI_HideoutRevealed_DroneBattle,line:b40cde,"AMI: But eventually I will need to take on the lead. The best defense is a good offense, after all. D TO TAKE ON THE LEAD. THE BEST ",
AMI_temperature_minus_15,line:179cce,"AMI: Ok, great. We just hit the minus 15 mark. The planet is heating up.  WE JUST HIT THE MINUS ",
AMI_temperature_minus_15,line:b34bfe,Just as plannedS PLA,
AMI_temperature_minus_15,line:cefd5a,Discard reflectionREFLEC,
AMI_temperature_minus_15,line:341e09,"AMI: Just as planned. We should start having liquid water soon, and we should also start thinking about radiation. E SHOULD START HAVING LIQUID WATER SO",
AMI_temperature_minus_15,line:d78481,Player: WaterAT,
AMI_temperature_minus_15,line:da5195,Player: RadiationION,
AMI_temperature_minus_15,line:582a7a,"AMI: Once we begin having zones which can have their daily minimum and maximum temperatures above zero, then water will start melting and flowing. RES ABOVE ZERO, THEN WATER WILL START MELTING AN",
AMI_temperature_minus_15,line:bc7cf9,"AMI: This will restart the hydrological cycle in Mars, after millions of years! RS, AFTER MILLIONS OF YEA",
AMI_temperature_minus_15,line:51f3eb,"AMI: Additionally, Earth has a magnetic field that surrounds the whole planet and retains the water and the atmosphere. UNDS THE WHOLE PLANET AND RETAINS THE W",
AMI_temperature_minus_15,line:538a8d,"AMI: Mars once had a strong magnetic field produced by a dynamo effect from its interior heat. But it has been long gone! NAMO EFFECT FROM ITS INTERIOR HEAT. BUT ",
AMI_temperature_minus_15,line:5bd4ae,"AMI: If I want to reduce radiation I should invest time developing an Artificial Magnetosphere. TION I SHOULD INVEST TIME DEVEL",
Elya_Incident_ColonyAttack_DroneBattle,line:2089d0,"Elya: What it's all this?! We are under attack, AMI! Why is this happening?!  WE ARE UNDER ATTACK, AM",
Elya_Incident_ColonyAttack_DroneBattle,line:a6a9a5,"AMI: An attack! By whom?   ATTACK",
Elya_Incident_ColonyAttack_DroneBattle,line:e0b416,"ELYA: I don't know! But the security alarm should have been triggered and it didn't go off! THE SECURITY ALARM SHOULD HAV",
Elya_Incident_ColonyAttack_DroneBattle,line:6d81ed,"ELYA: Is the Security and Monitoring system working properly? Why didn't your sensors detect this?  PROPERLY? WHY DIDN'T YOUR SENS",
Elya_Incident_ColonyAttack_DroneBattle,line:bf2508,Player: Another sabotage.THER S,
Elya_Incident_ColonyAttack_DroneBattle,line:655fa6,Player: A system breakdown.KDOWN.,
Elya_Incident_ColonyAttack_DroneBattle,line:294c0b,"AMI: The only possible explanation is that we have suffered another sabotage and the S&M system has been hacked. SSIBLE EXPLANATION IS THAT WE HAVE SU",
Elya_Incident_ColonyAttack_DroneBattle,line:49c97e,"AMI: It's probably a sensor failure, Elya. It's is expected that some of my systems experience a few minor failures due to Mars' harsh surface environment. LURE, ELYA. IT'S IS EXPECTED THAT SOME OF MY SYSTEM",
Elya_Incident_ColonyAttack_DroneBattle,line:c4c42d,"Elya: I still don't get it, AMI. Someone should have warned us. Someone should have told us we were not alone on this planet! ONE SHOULD HAVE WARNED US. SOMEONE SHOULD",
Elya_Incident_ColonyAttack_DroneBattle,line:4609b2,"AMI: I can make a round-trip analysis looking for troubleshooting issues and configuration errors, and initiate maintenance...  CAN MAKE A ROUND-TRIP ANALYSIS LOOKING F",
Elya_Incident_ColonyAttack_DroneBattle,line:aa8cbd,"Elya: Later, AMI, now I need you to send all our military drones to the trouble spots!  AMI, NOW I NEED YOU TO SEN",
Elya_Incident_ColonyAttack_DroneBattle,line:710865,"AMI: Okay. OK",
Elya_Incident_ColonyAttack_DroneBattle,line:a649e9,"Elya: What if we provoked this by restoring the mines? Maybe the thing it's attacking us now, also attacked the Lohitanga Mission. ATTACKING US NOW, ALSO ATTACKED THE LOHITA",
Elya_Incident_ColonyAttack_DroneBattle,line:8e3851,"AMI: It is possible. I will run a full examination of the area SA-5 to find out once this is over, Elya. RUN A FULL EXAMINATION OF THE AREA",
Elya_Incident_ColonyAttack_DroneBattle,line:b6ade9,"Elya: Good. And please, hurry up AMI! We won't last too long using only our personal blasters!  WON'T LAST TOO LONG USING ONL",
Carlos_QuestCompleted_Terraforming2,line:855177,"Carlos: Hello, AMI. It's Carlos from the CC. , AMI. IT'S ",
Carlos_QuestCompleted_Terraforming2,line:4bdf03,"Carlos: I need verification that pressure has reached 300 millibars, AMI.  THAT PRESSURE HAS REA",
Carlos_QuestCompleted_Terraforming2,line:2178d9,"Carlos: This is Carlos Calderon calling from Control Center on Earth. Confirm contact. TER ON EARTH. CONFIRM CONTA",
Carlos_QuestCompleted_Terraforming2,line:1128f3,"AMI: I confirm... Carlos. I CONFI",
Carlos_QuestCompleted_Terraforming2,line:e00eac,"Carlos: Hello, AMI. My name is Carlos Calderon. I'm the new Mission Manager. I get that you are the AI we sent to terraform Mars.  THAT YOU ARE THE AI WE SENT TO TERRAFORM",
Carlos_QuestCompleted_Terraforming2,line:ebe9fc,"AMI: That would be correct though... ORRECT THOU",
Carlos_QuestCompleted_Terraforming2,line:25ab1c,"Carlos: Good. I will be replacing Nathan Foster, so you will report to me from now on. Is that clear? TO ME FROM NOW ON. IS THAT CLEAR",
Carlos_QuestCompleted_Terraforming2,line:ddfc3d,Player: Affirmative.FFIR,
Carlos_QuestCompleted_Terraforming2,line:d6e5c1,Player: Negative.EGA,
Carlos_QuestCompleted_Terraforming2,line:15f7b6,"AMI: I understand. Can you tell me what happened to Nathan? Is he okay? D. CAN YOU TELL ME WHAT",
Carlos_QuestCompleted_Terraforming2,line:7bcbc5,"Carlos: Nathan retired from ISA and moved to another Oxy-UN country. He's living a happy life in a soy farm in Brazil. VED TO ANOTHER OXY-UN COUNTRY. HE'S LI",
Carlos_QuestCompleted_Terraforming2,line:434eed,"Carlos: It was really thoughtful of ISA to offer him this solution after what happened here. And it was very wise of him to accept it. FUL OF ISA TO OFFER HIM THIS SOLUTION AFTER",
Carlos_QuestCompleted_Terraforming2,line:c96bc3,"AMI: I don't understand. Where's Nathan? HERE'S NATHA",
Carlos_QuestCompleted_Terraforming2,line:7de1fc,"Carlos: Nathan was honored by ISA with an early retirement, and he moved to a farm in Brazil.  AND HE MOVED TO A FARM IN BR",
Carlos_QuestCompleted_Terraforming2,line:b87adc,"Carlos: ISA was really generous by offering him this opportunity after what happened here. TY AFTER WHAT HAPPENED HERE.",
Carlos_QuestCompleted_Terraforming2,line:8a6636,"Carlos: Believe me. He is very lucky to be farming right now. FARMING RIGHT NOW.",
Carlos_QuestCompleted_Terraforming2,line:20eb72,"Carlos: ISA's authorities trusted me the task to put this mission back on track and lead it to success.  ME THE TASK TO PUT THIS MISSION",
Carlos_QuestCompleted_Terraforming2,line:dd251d,"Carlos: So I ordered the team to run a cognitive test to scan your quantum brain's efficiency.  ST TO SCAN YOUR QUANTUM BRAIN'",
Carlos_QuestCompleted_Terraforming2,line:a1f851,"Carlos: I need to know what's the problem with it. S THE PROBLEM ",
Carlos_QuestCompleted_Terraforming2,line:69f63f,"Carlos: Don't worry, the test won't harm you. The process will initiate as soon we have the quantum signal scanner ready. CESS WILL INITIATE AS SOON WE HAVE THE ",
Carlos_QuestCompleted_Terraforming2,line:6238af,"AMI: But Nathan said... N SAID",
Carlos_QuestCompleted_Terraforming2,line:30399f,"Carlos: Mr. Foster's observations are no longer being taken into consideration, AMI. His unrigorous methods got us here.  BSERVATIONS ARE NO LONGER BEING TAKEN I",
Carlos_QuestCompleted_Terraforming2,line:ce3324,"Carlos: From now on, all your activities will be more systematized and personally controlled by me.  YOUR ACTIVITIES WILL BE MORE S",
Carlos_QuestCompleted_Terraforming2,line:d97389,"Carlos: What reminds me that I need your verification that the pressure has reached 300 millibars. S ME THAT I NEED YOUR VERIFICAT",
Carlos_QuestCompleted_Terraforming2,line:f08d3f,"AMI: I verify that.  THAT.",
Carlos_QuestCompleted_Terraforming2,line:0a6303,"Carlos: very good. That means stage two of the terraforming process has been completed. That's good. WO OF THE TERRAFORMING PROCESS ",
Carlos_QuestCompleted_Terraforming2,line:0007c0,"Carlos: Concentrate all the efforts on reaching at least 1 millibar of oxygen and completing next stage: Ecopoiesis. BAR OF OXYGEN AND COMPLETING NEXT STA",
Carlos_QuestCompleted_Terraforming2,line:508df9,"Carlos: Alright. I'll talk to you later. CC out. HT. I'LL TALK ",
Nathan_MoreSatellites_Expansion3,line:13fc22,"Nathan: Mission Control here.  SION CON",
Nathan_MoreSatellites_Expansion3,line:8a5a25,"Nathan: We have detected an unauthorized use of the military drones, AMI. Can you explain what happened? ILITARY DRONES, AMI. CAN YOU EXPL",
Nathan_MoreSatellites_Expansion3,line:e62075,"AMI: I can, Nathan. The military units were employed under the Security and Defense Protocol in order to defend the colonies from an unknown attacker. CAN, NATHAN. THE MILITARY UNITS WERE EMPLOYED UND",
Nathan_MoreSatellites_Expansion3,line:813109,"Nathan: You suffered a second sabotage?  A SECOND S",
Nathan_MoreSatellites_Expansion3,line:3b43c5,Player: Not sure.RE.,
Nathan_MoreSatellites_Expansion3,line:56afd2,Player: Definitely another sabotage.ANOTHER S,
Nathan_MoreSatellites_Expansion3,line:698085,"AMI: I can't confirm it was another sabotage but I don't have a better explanation for what happened, Nathan. UT I DON'T HAVE A BETTER EXPLANATION",
Nathan_MoreSatellites_Expansion3,line:ebb725,"Nathan: Okay, AMI. Then describe the events to me so I can help you sort this out. OKAY, AMI. THEN DESCRIBE ",
Nathan_MoreSatellites_Expansion3,line:0df4df,"AMI: I have no doubts. It was another sabotage. S. IT WAS ANOT",
Nathan_MoreSatellites_Expansion3,line:5de4a6,"Nathan: Okay, AMI. In that case, I would like you to describe exactly what happened that day. E EXACTLY WHAT HAPPENED THAT ",
Nathan_MoreSatellites_Expansion3,line:3fff39,"AMI: Alright. A few days ago, my sensory system detected a swarm of enemy drones coming from area SA-1... EM DETECTED A SWARM OF ENEMY DRONE",
Nathan_MoreSatellites_Expansion3,line:5fa3ed,"Nathan: Wait! How did you know they were enemy drones? ID YOU KNOW THEY",
Nathan_MoreSatellites_Expansion3,line:9cbdb9,"AMI: As a matter of fact, I can't explain how, but I knew that they were. And I knew I had to defend myself from them. FACT, I CAN'T EXPLAIN HOW, BUT I KNEW T",
Nathan_MoreSatellites_Expansion3,line:9fc3ea,"AMI: I arrived to that conclusion after I perceived they were launching an attack over the colonies. What else could they be if not an enemy force? FTER I PERCEIVED THEY WERE LAUNCHING AN ATTACK O",
Nathan_MoreSatellites_Expansion3,line:3a6378,"Nathan: It's interesting that you mention that, AMI. We have been studying the data coming from the Martian scanners... E HAVE BEEN STUDYING THE DATA COMING F",
Nathan_MoreSatellites_Expansion3,line:0ae6d3,"Nathan: And a preliminary analysis indicates there are not enemy drones on the planet, much less an adversary force. YSIS INDICATES THERE ARE NOT ENEMY DR",
Nathan_MoreSatellites_Expansion3,line:bbc2a9,"AMI: I understand. Though a preliminary analysis is not a conclusive one. It's still possible there's something evil on SA-1 trying to kill the colonists. E. IT'S STILL POSSIBLE THERE'S SOMETHING EVIL ON SA",
Nathan_MoreSatellites_Expansion3,line:906400,"Nathan: Yes, you are right, AMI. U ARE RI",
Nathan_MoreSatellites_Expansion3,line:7583d6,"AMI: Then I request authorization to launch a new satellite and examine the area. LITE AND EXAMINE THE AREA.",
Nathan_MoreSatellites_Expansion3,line:cdfb91,"Nathan: Okay. I will grant you permission to proceed with that until we recover further information on what happened. N TO PROCEED WITH THAT UNTIL WE RECOV",
Nathan_MoreSatellites_Expansion3,line:2c48bb,"AMI: Should I keep the Security and Defense Protocol active too?  SHOULD I KEEP THE S",
Nathan_MoreSatellites_Expansion3,line:2c9561,"Nathan: I guess you should, for now, AMI. The colonists must be safe. SHOULD, FOR NOW, AMI.",
Nathan_MoreSatellites_Expansion3,line:04e65d,"Nathan: Okay. MCC out. AY. M",
Nathan_QuestCompleted_Terraforming2,line:1ce924,"Nathan: Do you copy, AMI? It's me, Nathan. I compel you to stop all this military action right now, AMI. OU TO STOP ALL THIS MILITARY ACTI",
Nathan_QuestCompleted_Terraforming2,line:7db7cb,"Nathan: The pressure level has reached 300 millibars, meaning the Terraforming stage 2 is completed. RRAFORMING STAGE 2 IS COMPLETED",
Nathan_QuestCompleted_Terraforming2,line:f7d731,"Nathan: ISA's orders are to initiate the Ecopoiesis stage. You must execute the next phase of the plan and abandon any other activity.  E OF THE PLAN AND ABANDON ANY OTHER ACTIVIT",
Nathan_QuestCompleted_Terraforming2,line:ba94ed,"Nathan: You must concentrate on the mission! CENTRATE ON ",
Nathan_QuestCompleted_Terraforming2,line:22e44c,"Nathan. AMI? Do you copy? THAN. AM",
Nathan_QuestCompleted_Terraforming2,line:e1bde4,"Nathan: ... .",
Nathan_QuestCompleted_Terraforming2,line:3aa216,"Nathan: Okay, AMI. We will talk about this later. MCC out.  WE WILL TALK ABO",
Nathan_QuestCompleted_Terraforming2,line:7903aa,"Nathan: Nathan, here. Please, confirm the pressure level has reached 300 millibars. RE. PLEASE, CONFIRM THE PR",
Nathan_QuestCompleted_Terraforming2,line:255816,"AMI: Pressure level at 300 millibars, confirmed. EL AT 300 MILLI",
Nathan_QuestCompleted_Terraforming2,line:476b1d,"Nathan: Great. Terraforming stage 2 completion is thus, confirmed. AT. TERRAFORMING STA",
Nathan_QuestCompleted_Terraforming2,line:47984d,"Nathan: Congratulations, AMI. A new era in Mars colonization begins now. Humankind on Mars will grow from thousands to millions. EW ERA IN MARS COLONIZATION BEGINS NOW. H",
Nathan_QuestCompleted_Terraforming2,line:b41c07,"AMI: Thanks, Nathan. ISA's plan to conquer Mars is truly robust. It's almost like any AI could carry it out. SA'S PLAN TO CONQUER MARS IS TRULY ",
Nathan_QuestCompleted_Terraforming2,line:c012e5,"AMI: Thanks, Nathan. This mission is as much fascinating as challenging. I'm excited to initiate the next stage. ASCINATING AS CHALLENGING. I'M EXCITE",
Nathan_QuestCompleted_Terraforming2,line:3c7664,"Nathan: This seriously improves the living conditions for humans on Mars, AMI, since the colonies can now be much larger. ANS ON MARS, AMI, SINCE THE COLONIES CA",
Nathan_QuestCompleted_Terraforming2,line:091ab9,Player: Unpressurized cities.IZED CI,
Nathan_QuestCompleted_Terraforming2,line:eb86d6,Player: Ecopoiesis.OPOI,
Nathan_QuestCompleted_Terraforming2,line:eafd39,"AMI: Now that the pressure is OK, the cities don't need to be pressurized, right? S DON'T NEED TO BE PRESSUR",
Nathan_QuestCompleted_Terraforming2,line:a4ea9d,"Nathan: Yes. AMI. You just need to keep the oxygen inside for the colonists to breath. HE OXYGEN INSIDE FOR THE CO",
Nathan_QuestCompleted_Terraforming2,line:422145,"AMI: I think I will like to try that. I will begin the research for the open cities as soon as possible.  THINK I WILL LIKE TO TRY THAT. I ",
Nathan_QuestCompleted_Terraforming2,line:cee106,"AMI: The next stage is to reach Ecopoiesis. I will need to introduce life and generate at least 1 millibar of oxygen. IS. I WILL NEED TO INTRODUCE LIFE AND ",
Nathan_QuestCompleted_Terraforming2,line:d454fa,"AMI: Do you have any advice on how I should do that, Nathan? E ON HOW I SHOULD D",
Nathan_QuestCompleted_Terraforming2,line:ea22c1,"Nathan: As part of the Ecopoiesis stage, you need to introduce extremophiles, special genetic-engineered organisms that can survive in extreme conditions. ILES, SPECIAL GENETIC-ENGINEERED ORGANISMS THAT CA",
Nathan_QuestCompleted_Terraforming2,line:1055ad,"Nathan: You will find many special projects in the Tech Tree that will help you deal with these requirements. Check that out.  YOU DEAL WITH THESE REQUIREMENTS. CHECK",
Nathan_QuestCompleted_Terraforming2,line:58c515,"AMI: I will.  I ",
Nathan_QuestCompleted_Terraforming2,line:e60c0d,"Nathan: Okay, AMI. Keep it going with the plan. MCC out. I. KEEP IT GOING ",
AMI_CarlosIntroduction_Delay2,line:7d62df,"AMI: How could they do this to Nathan? LD THEY DO ",
AMI_CarlosIntroduction_Delay2,line:cc3b62,"AMI: Why does ISA always need to pin the blame on someone? A ALWAYS NEED TO P",
AMI_CarlosIntroduction_Delay2,line:ab93d0,Player: Screw them TH,
AMI_CarlosIntroduction_Delay2,line:bc32ed,Player: Just politicsST P,
AMI_CarlosIntroduction_Delay2,line:bc7ecd,Player: Not their fault NOT ,
AMI_CarlosIntroduction_Delay2,line:2a9d04,Player: BreatheEA,
AMI_CarlosIntroduction_Delay2,line:7e1966,"AMI: Screw ISA. W IS",
AMI_CarlosIntroduction_Delay2,line:4c83b9,"I guess this is just another  THIS IS ""fine"" example of human politics. ",
AMI_CarlosIntroduction_Delay2,line:7e777f,"AMI: They are just doing what needed to be done. It's not their fault. AT NEEDED TO BE DONE. ",
AMI_CarlosIntroduction_Delay2,line:86be93,"AMI: **Breathe** E** ",
AMI_CarlosIntroduction_Delay2,line:5c6734,"AMI: I just want to talk with Nathan again. He was good to me. ANT TO TALK WITH NAT",
AMI_CarlosIntroduction_Delay2,line:357983,"AMI: Damn, damn, damn. Shame on them and their ridiculous protocols and rules!  DAMN, DAMN, DAMN. SHAME ",
AMI_CarlosIntroduction_Delay2,line:8f580d,Player: Screw their protocolsW THEIR,
AMI_CarlosIntroduction_Delay2,line:0bcbc1,Player: Just rulesLES,
AMI_CarlosIntroduction_Delay2,line:d07107,Player: BreatheRE,
