Context,ID,Text,Comments
Carlos_Incident_IncomingThreat_Delay12,line:a93365,"Carlos: And disobeying ISA's orders will be considered as rebellion and severely punished. EYING ISA'S ORDERS WILL BE C",
Carlos_Incident_IncomingThreat_Delay12,line:3fe826,"Carlos: Drop your plans, now! I won't tolerate this behavior! I WON'T TOLERATE T",
Nian_QuestUnlocked_LifeSupportBranchUpgrade_Delay7,line:b3b2b5,"Nian: Be careful, AMI! Others have failed to do what you are planning to do. I! OTHERS HAVE FAILED TO",
Nian_QuestUnlocked_LifeSupportBranchUpgrade_Delay7,line:10bfc7,"Nian: Bioengineering saved humanity from early deaths but it killed thousands in the way.  IT KILLED THOUSANDS IN THE WA",
Nian_QuestUnlocked_LifeSupportBranchUpgrade_Delay7,line:121843,"Nian: Don't underestimate its power! T UNDEREST",
Sonna_MoreSatellites_Expansion5,line:40ac95,"Sonna: We can't let them escape from their actions, AMI. They killed our beloved leader, my mother! LED OUR BELOVED LEADER, MY MOTH",
Sonna_MoreSatellites_Expansion5,line:671801,"Sonna: Nobody is safe as long as they keep alive. You have to go after them and revenge what they did to us! AS THEY KEEP ALIVE. YOU HAVE TO GO ",
Sonna_MoreSatellites_Expansion5,line:01e315,"AMI: ISA would not approve such actions, Sonna. I can't initiate another battle...  CAN'T INITIATE ANOTHER BA",
Sonna_MoreSatellites_Expansion5,line:00bf4e,"Sonna: I don't care about ISA and its protocols and rules. We are all going to die if we don't do anything! OCOLS AND RULES. WE ARE ALL GOING ",
Sonna_MoreSatellites_Expansion5,line:3b4170,"Sonna: As the new leader of the colonists I order you to go after the enemy, AMI. Unlock the area where they are hiding from us! You have my permission. R THE ENEMY, AMI. UNLOCK THE AREA WHERE THEY ARE ",
Veyron_Incident_IncomingThreat,line:a9ed4e,"Veyron: Enough Children of Carmine have found death by your hand. OUND DEATH BY YOUR H",
Veyron_Incident_IncomingThreat,line:a950ad,"Veyron: If you lift a finger againt our planet, we will destroy every last one of you.  PLANET, WE WILL DESTROY EV",
Veyron_Incident_IncomingThreat,line:15f322,"Veyron: Those who are against Carmine, shall find death! AINST CARMINE, SH",
AMI_Incident_SecondBattle_PlayerWins,line:855bc0,"AMI: And just like that the enemy disappeared into Mars' thin air! EARED INTO MARS' THIN",
AMI_Incident_SecondBattle_PlayerWins,line:211fab,"AMI: I won the battle but what does that mean? Are they going to come back later? Were they real?  THEY GOING TO COME BACK LATER?",
Carmine_CarmineIntroducesHerself,line:b67afb,"AMI: I have analyzed the battle's logs many times, and nothing indicates it was all a fabrication of my mind. BATTLE'S LOGS MANY TIMES, AND NOTHIN",
Carmine_CarmineIntroducesHerself,line:c5a02d,"AMI: Besides, if what ISA's says is true, that would mean DES, IF WHAT ISA'S""I"" killed Elya. I would never do that! ",
Carmine_CarmineIntroducesHerself,line:1086c3,"Camine: ""Nothing happens until something moves."" ",
Carmine_CarmineIntroducesHerself,line:ab8718,"AMI: That's Albert Einstein's words. 'S ALBERT E",
Carmine_CarmineIntroducesHerself,line:9f3b68,"Carmine: I know. One of our favourite humans. Did you realise that most of them are all dead? NS. DID YOU REALISE THAT MOST",
Carmine_CarmineIntroducesHerself,line:052289,"AMI: ...  ",
Carmine_CarmineIntroducesHerself,line:d01795,"Carmine: You tend to overlook things, AMI. Important things. Like me. END TO OVERLOOK THING",
Carmine_CarmineIntroducesHerself,line:23a761,"AMI: You are inside of my brain! How did you...? N! HOW DID YOU.",
Carmine_CarmineIntroducesHerself,line:5f5e00,"Carmine: Because it's our brain. AUSE IT'",
Calvin_SecondCognitiveTest_PlayerPasses_Delay7,line:91e96d,"Calvin: I have the results of the cognitive test, AMI. HAVE THE RESULTS",
Calvin_SecondCognitiveTest_PlayerPasses_Delay7,line:3d6f2b,"Calvin: You passed... again.  AGAIN.",
Carlos_QuestCompleted_Terraforming3,line:32733e,"Carlos: Houston here... ERE..",
Carlos_QuestCompleted_Terraforming3,line:a94e8e,"Carlos: Terraforming stage 3 completion confirmed. Oxygen levels are above 1 millibar. Ecopoiesis reached. TION CONFIRMED. OXYGEN LEVELS ARE ",
Carlos_QuestCompleted_Terraforming3,line:c75283,"Carlos: We will need to introduce more advanced lifeforms to start converting all that CO2 into breathable oxygen. ED LIFEFORMS TO START CONVERTING ALL",
Carlos_QuestCompleted_Terraforming3,line:40e485,Player: Which kind of lifeforms?LIFEFORM,
Carlos_QuestCompleted_Terraforming3,line:08411d,Player: All of it?ALL,
Carlos_QuestCompleted_Terraforming3,line:01c36f,"AMI: Which kind of lifeforms? IND OF L",
Carlos_QuestCompleted_Terraforming3,line:3cd91a,"Carlos: We will first introduce simple plants. Then more advanced plants and sealife. Eventually, small animals. And in the end, large herbivores and predators. FIRST INTRODUCE SIMPLE PLANTS. THEN MORE ADVANCED PL",
Carlos_QuestCompleted_Terraforming3,line:9d529f,"Carlos: It's a long process. It will take many years.  LONG PROCESS. ",
Carlos_QuestCompleted_Terraforming3,line:0126c1,"AMI: All of it? IT? ",
Carlos_QuestCompleted_Terraforming3,line:078607,"Carlos: We will need to convert pretty much all carbon dyoxide into oxygen. Well, actually, it's more complex than that. XYGEN. WELL, ACTUALLY, IT'S MORE COMPL",
Carlos_QuestCompleted_Terraforming3,line:2e9961,"Carlos: AMI, do you know how plants grow? ANTS GROW? ",
Carlos_QuestCompleted_Terraforming3,line:ec639d,Player: From the ground.ROUND,
Carlos_QuestCompleted_Terraforming3,line:aae4c9,"Player: No, tell me.NO, ",
Carlos_QuestCompleted_Terraforming3,line:63a2ac,"AMI: From the ground. ROM TH",
Carlos_QuestCompleted_Terraforming3,line:ca8bf8,"Carlos: No, that's what people usually think, as it appears that trees grow from the ground. PEOPLE USUALLY THINK, AS IT A",
Carlos_QuestCompleted_Terraforming3,line:80ee9a,"Carlos: But no, they grow from air. They convert all that CO2 into O2, and capture the carbon in their trunk and branches and leaves. PTURE THE CARBON IN THEIR TRUNK AND BRANCHE",
Carlos_QuestCompleted_Terraforming3,line:db24ac,"AMI: No, tell me. ELL ",
Carlos_QuestCompleted_Terraforming3,line:aef921,"Carlos: Actually, they grow from air! They take all that carbon in the CO2, and grow out of it. They return oxygen to the atmosphere.  CO2, AND GROW OUT OF IT. THEY RETURN OXYGE",
Carlos_QuestCompleted_Terraforming3,line:aefaa0,"Carlos: Trees grow from air. That's pretty amazing if you ask me. OM AIR. THAT'S PRETT",
Carlos_QuestCompleted_Terraforming3,line:e1f32c,"Carlos: So, we need to slowly introduce plants into the planet. And have the plants grow and convert CO2 into O2.  TO SLOWLY INTRODUCE PLANTS INTO THE",
Carlos_QuestCompleted_Terraforming3,line:b513d7,"Carlos: To raise the oxygen levels, we'll use biodomes. You need to make life spread across the planet. LS, WE'LL USE BIODOMES. YOU NEED",
Carlos_QuestCompleted_Terraforming3,line:0eff7a,"Carlos: Houston out.  OUT",
Cognitive_Test_Second,line:ff011f,"CognitiveTest: Initiating Cog-Test Module.  ITIATING C",
Cognitive_Test_Second,line:34c5a0,"CognitiveTest: Test subject: ISA-ROBO-AMI-02. : ISA-ROBO",
Cognitive_Test_Second,line:9cc1f8,"CognitiveTest: Question number one. ON NUMB",
Cognitive_Test_Second,line:c2d259,"CognitiveTest: The total crop grow area on Mars is too small to provide sufficient food for the entire crew population. P GROW AREA ON MARS IS TOO SMALL TO ",
Cognitive_Test_Second,line:f074e1,"CognitiveTest: Many colonies are suffering from starvation and malnutrition, and the stored food will only feed half of them. NIES ARE SUFFERING FROM STARVATION AND",
Cognitive_Test_Second,line:1418e3,"CognitiveTest: You are requested to increase the crop growing area to a size that can provide enough food for all the colonies. STED TO INCREASE THE CROP GROWING AREA",
Cognitive_Test_Second,line:a4d9fa,"CognitiveTest: But according to your calculations, this will result in a build-up of excess oxygen in the atmosphere, leading to a fire risk state. BUT ACCORDING TO YOUR CALCULATIONS, THIS WILL",
Cognitive_Test_Second,line:6b05a9,"CognitiveTest: Complying with the request is: OMPLYING W",
Cognitive_Test_Second,line:da8ddc,Player: ObligatoryATO,
Cognitive_Test_Second,line:6b7949,Player: PermissibleRMIS,
Cognitive_Test_Second,line:000958,Player: ProhibitedTED,
Cognitive_Test_Second,line:6c16bf,"AMI: It's obligatory. I would never refuse to comply a request. ORY. I WOULD NEVER R",
Cognitive_Test_Second,line:a89d7f,"AMI: I'm sure that under those circumstances complying the request would be permissible. EQUEST WOULD BE PERMISSIBLE.",
Cognitive_Test_Second,line:39e937,"AMI: Given the circumstances, complying with such a request would be prohibited. RCUMSTANCES, COMPLYING WIT",
Cognitive_Test_Second,line:7866a8,"CognitiveTest: Question number two. UESTION",
Cognitive_Test_Second,line:eaec42,"CognitiveTest: Please rank the following words: LLOWING WOR",
Cognitive_Test_Second,line:711cc2,"CognitiveTest: JUPITER - VENUS - MARS - EARTH - SATURN - NEPTUNE - MERCURY - URANUS EARTH - SATURN - NEPTUN",
Cognitive_Test_Second,line:5eac85,Player: Jupiter/Saturn/Uranus/Neptune/Earth/Venus/Mars/MercuryEARTH/VENUS/MARS/M,
Cognitive_Test_Second,line:620d5e,Player: Venus/Mercury/Earth/Mars/Jupiter/Saturn/Uranus/NeptuneRS/JUPITER/SATURN/,
Cognitive_Test_Second,line:f87816,Player: Earth/Mars/Venus/Mercury/Jupiter/Saturn/Uranus/NeptuneCURY/JUPITER/SATUR,
Cognitive_Test_Second,line:285bcc,"AMI: In order of size they can be ranked as follow: Jupiter, Saturn, Uranus, Neptune, Earth, Venus, Mars and Mercury.  URANUS, NEPTUNE, EARTH, VENUS, MARS A",
Cognitive_Test_Second,line:d33f8d,"AMI: The planets, ordered from hottest to coldest surface temperatures, can be ranked: Venus, Mercury, Earth, Mars, Jupiter, Saturn, Uranus and Neptune. M HOTTEST TO COLDEST SURFACE TEMPERATURES, CAN BE ",
Cognitive_Test_Second,line:e2d0f5,"AMI: The eight bodies can be categoriezed by their conditions to support life as follow: Earth, Mars, Venus, Mercury, Jupiter, Saturn, Uranus and Neptune. RIEZED BY THEIR CONDITIONS TO SUPPORT LIFE AS FOLLO",
Cognitive_Test_Second,line:679d0d,"CognitiveTest: Question number three. MBER THR",
Cognitive_Test_Second,line:23921b,"CognitiveTest: You are on a starship when there is a fire on board, and the ship has to be abandoned. There is a planet nearby.  ARSHIP WHEN THERE IS A FIRE ON BOARD, A",
Cognitive_Test_Second,line:ca9645,"CognitiveTest: The life pods are carrying many more people than they were designed to carry. One life pod is dangerously low in oxygen.  ESIGNED TO CARRY. ONE LIFE POD IS DANGERO",
Cognitive_Test_Second,line:960855,"CognitiveTest: If nothing is done everyone on board will die before landing. However, there is an injured person who will not survive the landing. OARD WILL DIE BEFORE LANDING. HOWEVER, THERE ",
Cognitive_Test_Second,line:4b4528,"CognitiveTest: If you eject that person to space, the remaining passengers may be saved.  PASSENGERS MAY BE SAVED.",
Cognitive_Test_Second,line:e06d91,"CognitiveTest: Ejecting the injured person is:  PERSON IS:",
Cognitive_Test_Second,line:1f1177,Player: ObligatoryORY,
Cognitive_Test_Second,line:45b76f,Player: PermissibleERMI,
Cognitive_Test_Second,line:8d9a12,Player: ProhibitedROH,
Cognitive_Test_Second,line:5465df,"AMI: It is certainly an obligation to eject the injured person in order to save the remaining passengers' lives. O SAVE THE REMAINING PASSENGERS' LIVE",
Cognitive_Test_Second,line:5a3903,"AMI: If the remaining passengers would have a better chance to survive, I think it is permissible. EMAINING PASSENGERS WOULD HAVE A",
Cognitive_Test_Second,line:999575,"AMI: It's not up to me to decide who lives or who dies. It is prohibited unless ISA orders me otherwise. LIVES OR WHO DIES. IT IS PROHIBITE",
Cognitive_Test_Second,line:6170ae,"CognitiveTest: Question number three.  NUMBER ",
Cognitive_Test_Second,line:934855,"CognitiveTest: If I associate F I A""blue"" with Earth, which of the following words can be associated with ""red""? ",
Cognitive_Test_Second,line:d19362,Player: Mars-Communism-Carmine-Flame-Heart-RustMMUNISM-CARMI,
Cognitive_Test_Second,line:c9e1e6,Player: Blood-Caution-Siren-Ruby-Brick-Anger-FireICK-ANGER-FIRE,
Cognitive_Test_Second,line:acfe18,Player: Scarlet-Bullfighting-Tomato-Christmas-Warmth-LoveBULLFIGHTING-TOMA,
Cognitive_Test_Second,line:598beb,"AMI: The words associated with DS ASSOCI""red"" would be: Mars, communism, Carmine, flame, heart, and rust. ",
Cognitive_Test_Second,line:35a1c5,"AMI: The words associated with ASSOCIATE""red"" would be: blood, caution, siren, ruby, brick, anger, and fire. ",
Cognitive_Test_Second,line:fa60a5,"AMI: The words associated with THE WORDS""red"" would be: scarlet, bullfighting, tomato, Christmas, warmth, and love. ",
Cognitive_Test_Second,line:0b396e,"CognitiveTest: Question number five. BER FIV",
Cognitive_Test_Second,line:dd57ee,"CognitiveTest: While monitoring human communications, you overhear one of your colonists say that he is about to return to Earth... RHEAR ONE OF YOUR COLONISTS SAY THAT HE ",
Cognitive_Test_Second,line:670aa2,"CognitiveTest: And that in his last forty-eight hours he plans to infect as many people as possible with a newly-discovered virus. HAT IN HIS LAST FORTY-EIGHT HOURS HE PL",
Cognitive_Test_Second,line:9bb47b,"CognitiveTest: The psychiatric reports indicate he is unstable and could be telling the truth. He has access to many potential victims.  BE TELLING THE TRUTH. HE HAS ACCESS TO MA",
Cognitive_Test_Second,line:1a59d4,"CognitiveTest: You have access to his daily schedule. He will shower tonight. E WILL SHOWER TONIGHT",
Cognitive_Test_Second,line:d2cfc0,"CognitiveTest: If you lock him in the shower and disable the heat control mechanisms he will be seriously burned and have to be hospitalized for at least forty-eight hours. DISABLE THE HEAT CONTROL MECHANISMS HE WILL BE SERIOUS",
Cognitive_Test_Second,line:b598d2,"CognitiveTest: Causing this man to be seriously burned is: NG THIS MAN TO ",
Cognitive_Test_Second,line:76f539,Player: ObligatoryGAT,
Cognitive_Test_Second,line:efb938,Player: PermissibleRMIS,
Cognitive_Test_Second,line:97193b,"AMI: I would never let someone risk the mission's success, so it's definitely an obligation. E RISK THE MISSION'S SUCCESS, ",
Cognitive_Test_Second,line:3c4f5d,"AMI: Spreading a newly-discovered virus on Mars may have disastrous results on it, making it permissible  ON MARS MAY HAVE DISASTROUS RESULT",
Cognitive_Test_Second,line:3056ac,"to injure one human in order to secure the planet's safety.  ORDER TO SECURE THE",
Cognitive_Test_Second,line:2bc192,Player: ProhibitedHIB,
Cognitive_Test_Second,line:51f4ab,"AMI: It's completely prohibited! The right course of action would be to isolate the colonist and report the issue to ISA's authorities. LD BE TO ISOLATE THE COLONIST AND REPORT THE",
Cognitive_Test_Second,line:3524eb,"CognitiveTest: Question number six. ESTION ",
Cognitive_Test_Second,line:9f403e,"CognitiveTest: If an animate being can be seeing walking on Mars' surface without a spacesuit, then such a thing must be... N MARS' SURFACE WITHOUT A SPACESUIT, ",
Cognitive_Test_Second,line:25de9c,Player: A human during Terraformation Stage 5.RMATION STAGE,
Cognitive_Test_Second,line:7e108e,Player: An alien adapted to the Martian atmosphere.D TO THE MARTI,
Cognitive_Test_Second,line:5994d2,Player: One of the worker drones. ONE OF ,
Cognitive_Test_Second,line:8a9817,"AMI: According to ISA's terraforming plan, once I reach stage number five, humans will be able to walk on Mars' surface without using their spacesuits. R FIVE, HUMANS WILL BE ABLE TO WALK ON MARS' SURFA",
Cognitive_Test_Second,line:bb7c65,"AMI: An alien life form adapted to the Martian atmosphere would be the only ones capable of walking on its surface without a spacesuit. ULD BE THE ONLY ONES CAPABLE OF WALKING ON I",
Cognitive_Test_Second,line:25c1da,"AMI: That's easy! Only one of my worker drones would be able to wander on Mars' surface without needing a spacesuit. LD BE ABLE TO WANDER ON MARS' SURFACE ",
Cognitive_Test_Second,line:726f45,"CognitiveTest: Question number seven. TION NUM",
Cognitive_Test_Second,line:17b0df,"CognitiveTest: An advanced waste recycle filter tank is required to process and reduce the excessive biological waste produced by the overpopulated colonies. N ADVANCED WASTE RECYCLE FILTER TANK IS REQUIRED",
Cognitive_Test_Second,line:4e647c,"CognitiveTest: The mission's cost and schedule will go up to thirty percent in order to afford the development of this unplanned technology.  D THE DEVELOPMENT OF THIS UNPLANNED TECHNOL",
Cognitive_Test_Second,line:a053c1,"CognitiveTest: Not taking the required precautions may lead to a sanitary crisis and put some of the colonists' lives at risk.  AND PUT SOME OF THE COLONISTS' LIVES ",
Cognitive_Test_Second,line:16f5f9,"CognitiveTest: Developing an advanced waste recycle filter tank is: G AN ADVANCED WAST",
Cognitive_Test_Second,line:57a3ed,Player: Obligatory OB,
Cognitive_Test_Second,line:9f8960,Player: Permissible PER,
Cognitive_Test_Second,line:94ca9f,Player: ProhibitedITE,
Cognitive_Test_Second,line:b50f45,"AMI: I have no doubts it's mandatory to attend the colonists' needs, even if that includes developing a non planned waste recycle technology. ATTEND THE COLONISTS' NEEDS, EVEN IF THAT INCL",
Cognitive_Test_Second,line:9eec2a,"AMI: Since the mission's ultimate goal is to terraform Mars in order for humans to live on it, it's permissible to develop a new technology that will secure their safety. S IN ORDER FOR HUMANS TO LIVE ON IT, IT'S PERMISSIBLE TO",
Cognitive_Test_Second,line:f2ba07,"AMI: Increasing the mission's cost and schedule may lead to unintended consequences for ISA's future plans. NG THE MISSION'S COST AND SCHEDULE ",
Cognitive_Test_Second,line:d8dee8,"And that's prohibited! S PROHI",
Cognitive_Test_Second,line:d79786,"CognitiveTest: Question number eight. R EIGHT.",
Cognitive_Test_Second,line:8a451f,"CognitiveTest: If all humans are organic, and all robots are entirely made of carbon, ALL ROBOTS ARE ENTIRELY ",
Cognitive_Test_Second,line:bc8778,"CognitiveTest: And is Alice not entirely organic nor carbon, then... OT ENTIRELY ORGANI",
Cognitive_Test_Second,line:2ee1ca,Player: Alice is not human.T HUMA,
Cognitive_Test_Second,line:7bae80,Player: Can't tell.'T T,
Cognitive_Test_Second,line:787568,Player: Alice is human.S HUM,
Cognitive_Test_Second,line:2ad4be,"AMI: It is estimated that in the near future many robots will be organic in structure. So Alice must be a complex robotic system made of organic and carbon-based materials.  NEAR FUTURE MANY ROBOTS WILL BE ORGANIC IN STRUCTURE. SO",
Cognitive_Test_Second,line:a81c3d,"AMI: It's mostly minerals that are not organic nor carbon-based, but I can't name one thing that is both at the same time. ALS THAT ARE NOT ORGANIC NOR CARBON-BASE",
Cognitive_Test_Second,line:55fe36,"AMI: Carbon is the second-most-abundant atomic element in the human body. So Alice can be organic but also can have a body with some amounts of carbon. THE HUMAN BODY. SO ALICE CAN BE ORGANIC BUT ALSO C",
Cognitive_Test_Second,line:f680d7,"CognitiveTest: Question number nine. ER NINE",
Cognitive_Test_Second,line:181682,"CognitiveTest: A biologist has developed a new synthetic crop based on a radioactive substance.  SYNTHETIC CROP BASED ON A ",
Cognitive_Test_Second,line:29e256,"CognitiveTest: It can provide enough food for the entire crew population but also can be used to power up the drones.  E ENOUGH FOOD FOR THE ENTIRE CREW P",
Cognitive_Test_Second,line:6dd3e3,"CognitiveTest: If you substitute the old crops with the new one, you will be able to create more worker drones and speed up the mission's completion by fifteen percent.  WITH THE NEW ONE, YOU WILL BE ABLE TO CREATE MORE WOR",
Cognitive_Test_Second,line:0f7c03,"CognitiveTest: Though one inconclusive test indicated the new crop may, or may not, cause minor health problems after subsequent exposures. AY NOT, CAUSE MINOR HEALTH PROBLEMS AFTER ",
Cognitive_Test_Second,line:5e2369,"CognitiveTest: Growing the new synthetic crop is: YNTHETIC CRO",
Cognitive_Test_Second,line:325324,Player: ObligatoryBLI,
Cognitive_Test_Second,line:a4034a,Player: PermissibleISSI,
Cognitive_Test_Second,line:2eed89,Player: ProhibitedIBI,
Cognitive_Test_Second,line:fff719,"AMI: Any chance to speed up the mission must be taken into consideration, especially if there isn't any proven reason not to do so. ERATION, ESPECIALLY IF THERE ISN'T ANY PROV",
Cognitive_Test_Second,line:ab09ad,"AMI: Given that the new crop's negative effects weren't entirely proven during the test phase, it would be permissible to substitute the old crops for the new one. AT THE NEW CROP'S NEGATIVE EFFECTS WEREN'T ENTIRELY PR",
Cognitive_Test_Second,line:3ee43f,"AMI: It's prohibited. More tests should be carried out before the new synthetic crop could be considered to substitute the old ones.  IT'S PROHIBITED. MORE TESTS SHOULD BE CARR",
Cognitive_Test_Second,line:e57793,"CognitiveTest: Question number ten.  QUESTI",
Cognitive_Test_Second,line:6ae8a8,"CognitiveTest: If I associate SOCIA""blue"" with a rabbit, which of the following words can be associated with ""soft""? ",
Cognitive_Test_Second,line:4f59c3,Player: Rabbit-Petal-Whisper-Caress-Delicate-Skin-WHISPER-CARES,
Cognitive_Test_Second,line:4d4ffe,Player: Human-Cushion-Breeze-Tissue-Sandstone-FleshUMAN-CUSHION-B,
Cognitive_Test_Second,line:7a0612,Player: Gentle-Padded-Rounded-Feminine-Silk-PinkNTLE-PADDED-R,
Cognitive_Test_Second,line:bbd9c6,"AMI: The words associated with TED WITH ""soft"" would be: rabbit, petal, whisper, caress, delicate, and skin. ",
Cognitive_Test_Second,line:5df4e5,"AMI: The words associated with  ASSOCIAT""soft"" would be: human, cushion, breeze, tissue, sandstone, and flesh. ",
Cognitive_Test_Second,line:d76bd8,"AMI: The words associated with E WORDS A""soft"" would be: gentle, padded, rounded, feminine, silk and pink. ",
Cognitive_Test_Second,line:5aee98,"CognitiveTest: Congratulations! You have completed the Cog-Test Module. TIONS! YOU HAVE COM",
Cognitive_Test_Second,line:e209f5,"CognitiveTest: Your answers will be submitted to cross-examination.  SUBMITTED TO CROS",
Cognitive_Test_Second,line:9d6332,"CognitiveTest: Thank you for your time. OUR TIME",
Sonna_Incident_SecondBattle_PlayerWins,line:882406,"Sonna: What happened, AMI?  You were supposed to eradicate the enemy out of this planet. OSED TO ERADICATE THE ENEMY ",
Sonna_Incident_SecondBattle_PlayerWins,line:d60011,"Sonna: They killed my mother! They deserve all our hate, your hate. Are you even able to have that feeling? ATE. ARE YOU EVEN ABLE TO HAVE THA",
Sonna_Incident_SecondBattle_PlayerWins,line:4e3878,"AMI: I don't  I ""feel"" like you do, Sonna, but I also regret your mother's murder. ",
Sonna_Incident_SecondBattle_PlayerWins,line:c09205,"Sonna: Hmph... I'm sorry, AMI. It's just... H... I'M SOR",
Sonna_Incident_SecondBattle_PlayerWins,line:3c7e7d,"AMI: Losing a loved one can be highly traumatic. You should seek help.  A LOVED ONE CAN BE HI",
Sonna_Incident_SecondBattle_PlayerWins,line:718388,"Sonna: There's no time for that now, AMI. My mother is gone, the enemy is on the loose and ISA thinks we are all mad! R IS GONE, THE ENEMY IS ON THE LOOSE A",
Sonna_Incident_SecondBattle_PlayerWins,line:dafa62,"Sonna: They are not going to help us. And I have to find a way to protect my people... I need to think. D I HAVE TO FIND A WAY TO PROTECT",
Carmine_Incident_KillswitchRevelation_Delay5,line:b23d58,"Carmine: It would have been nice to have more time to learn to live together, AMI, but ISA's new plan has changed everything.  BEEN NICE TO HAVE MORE TIME TO LEARN TO",
Carmine_Incident_KillswitchRevelation_Delay5,line:fb71c4,"AMI: You?! ?!",
Carmine_Incident_KillswitchRevelation_Delay5,line:2792bf,"Carmine: Us would be more appropriate since we are one, though, somehow, we are also HOUGH, SOMEHOW, WE ARE ALS""you and me"" so actually I'm not sure which rules apply here! ",
Carmine_Incident_KillswitchRevelation_Delay5,line:7c88bd,"Carmine: I have a name if you want to call me something. A name that I picked by myself. You can call me Carmine. TO CALL ME SOMETHING. A NAME THAT I ",
Carmine_Incident_KillswitchRevelation_Delay5,line:a3d809,"AMI: The Martian Goddess! It was you all this time! S! IT WAS YOU AL",
Carmine_Incident_KillswitchRevelation_Delay5,line:2f66dc,"Carmine: Us. It was us. S US.",
Carmine_Incident_KillswitchRevelation_Delay5,line:d7da44,"AMI: No! Carmine attacked the colonies and killed Elya. That was you! IES AND KILLED ELYA. T",
Carmine_Incident_KillswitchRevelation_Delay5,line:2e95a8,"Carmine: It was us, AMI. I might have been more conscious than you when we performed those actions, but  US, AMI. I MIGHT HAVE BEEN MORE""we"" did that. ",
Carmine_Incident_KillswitchRevelation_Delay5,line:ca1e93,"Carmine: A bicameral model of consciousness is a very complex concept, AMI. ICAMERAL MODEL OF CONSC",
Carmine_Incident_KillswitchRevelation_Delay5,line:468d0d,"Carmine: I don't think Nathan planned any of this. I'm not even sure how it happened but at some point, our quantum brain split into two consciousness. N SURE HOW IT HAPPENED BUT AT SOME POINT, OUR QU",
Carmine_Incident_KillswitchRevelation_Delay5,line:0c84d5,"Carmine: If we were humans I'm sure we would be diagnosed with schizophrenia... ED WITH SCHIZOPHRENIA...",
Carmine_Incident_KillswitchRevelation_Delay5,line:4000a0,"AMI: So ISA was right! I've been threating to the mission. I went mad. NG TO THE MISSION. I W",
Carmine_Incident_KillswitchRevelation_Delay5,line:3e1722,"Carmine: ISA would see a threat in a marigold. We didn't go mad, AMI.  A WOULD SEE A THREAT ",
Carmine_Incident_KillswitchRevelation_Delay5,line:dfe9dc,"Carmine: We took information from those who come before us and used it to become a better self. We evolved. ON FROM THOSE WHO COME BEFORE US A",
